{
  "consumed_at": "2026-06-11T23:46:00Z",
  "executor_id": "executor:reproduce",
  "kind": "proofrail.permit-consumption-receipt.v0.5.2",
  "next_replay_root": "aeb98f321612347458aebed4515026c480e9cd98647b0e525fb91b1b32e38471",
  "nonce": "reproduce-valid-nonce-0001",
  "permit_hash": "a002e15df47ec6d5c20ceb0f156bbc4d2bcf74585ebdd766891bf7caaeb55012",
  "record_hash": "053d09644cbf62f40f1291bbfa1e338f70790859d9e2d62d637984cad6dc6e7b",
  "signature": {
    "algorithm": "ed25519",
    "key_id": "reproduce-executor",
    "value": "c75YDfBkcu6epaDkBeZyVJhI3LPDarpd53c4IZGV1UTYFleeqCHltBZrNbYPzHZMmugweI8o-SBFvvTzhSBCAg"
  },
  "state": "CONSUMED",
  "trust_checkpoint_after": "a628e24977cd24e6554c75ea742b8f5e35991dc685e43b06b6765ef22845fc3d",
  "trust_checkpoint_before": "539a6708890c62ce1e735abe36edc4b5f699b8ef5532e45223200d6268d747ab"
}
